{
  "schema": "worldstream/result-projector-revision/v1",
  "projector_id": "worldstream.midnight-archive.result",
  "version": "0.1.0",
  "runtime": {
    "id": "worldstream.result-projector.declarative",
    "version": "1.0.0",
    "digest": "blake3:7278757ac8f047330292e399ac3c8f4ed49225b05ecb6b997b75500784b0526e"
  },
  "input": {
    "pack": {
      "id": "worldstream.midnight-archive",
      "version": "0.1.0",
      "digest": "blake3:f40e0a287fcaac6e6bc56629d361ede079d6c3c60aa0068caa3a451dfb8c0b64"
    },
    "listing_schema": "worldstream/activity-listing-revision/v1",
    "complete_head_schema": "worldstream/complete-head/v1",
    "projection": {
      "schema": "worldstream.midnight-archive/public-projection/v3",
      "digest": "blake3:d6042c76a9f09bc4bc1ea3fac8c443bc6f7f154f39aed4cd7aad5b60b956949f"
    }
  },
  "program": {
    "schema": "worldstream/result-projector-program/v1",
    "terminal": {
      "field": "phase",
      "equals": "complete"
    },
    "outcome_field": "outcome",
    "summary_fields": [
      {
        "output": "outcome",
        "source": "kind",
        "kind": "enum",
        "values": [
          "success",
          "partial_extraction",
          "wrong_ledger",
          "no_ledger",
          "exhausted_inside"
        ]
      }
    ]
  },
  "output": {
    "schema": "midnight-archive/terminal-summary/v1",
    "schema_digest": "blake3:dc4772ec95b72de7fe6d937a51844d9d1ff48cd01c01a2227408ef474b8d792e",
    "canonicalizer": "worldstream/canonical-json/v1",
    "maximum_bytes": 1024
  },
  "maximum_input_bytes": 65536
}
